{
  "aliases": [],
  "canonical": "R-000145",
  "created": "2026-09-20",
  "discovery": [
    {
      "channel": "A",
      "first_seen": "2026-09-20",
      "last_seen": "2026-09-26",
      "record": "R-000145"
    },
    {
      "channel": "G",
      "first_seen": "2026-09-20",
      "last_seen": "2026-09-26",
      "record": "R-000145"
    }
  ],
  "evidence": [
    {
      "criterion": 1,
      "detail": {
        "first_seen": "2026-09-20",
        "last_seen": "2026-09-26",
        "list_key": "list:older:e932c3d7864f",
        "page": "older"
      },
      "excerpt": null,
      "first_seen": "2026-09-20",
      "label": "Listed on UWPR's publications page",
      "last_seen": "2026-09-26",
      "record": "R-000145",
      "rule": "R1",
      "rule_version": "2026-09-26.1",
      "section": "official list",
      "source": {
        "cache": null,
        "name": "UWPR website",
        "retrieved": "2026-09-26",
        "url": "https://proteomicsresource.washington.edu/publications/older/"
      }
    },
    {
      "criterion": 3,
      "detail": {},
      "excerpt": "University of Washington Proteomics Resources, Seattle, Washington, USA",
      "first_seen": "2026-09-20",
      "label": "An author's affiliation is the UW Proteomics Resource",
      "last_seen": "2026-09-20",
      "record": "R-000145",
      "rule": "R5",
      "rule_version": "2026-09-26.1",
      "section": "affiliation",
      "source": {
        "cache": null,
        "name": "OpenAlex",
        "retrieved": "2026-09-20",
        "url": "https://api.openalex.org/works/W2189767351"
      }
    }
  ],
  "id": "W-000145",
  "records": [
    {
      "abstract": null,
      "authors": [
        {
          "affiliations": [
            {
              "country": "US",
              "name": "Boyce Thompson Institute",
              "raw": "Boyce Thompson Institute for Plant Research, Ithaca, New York, USA",
              "ror": "016tr2327"
            },
            {
              "country": "US",
              "name": "Agricultural Research Service",
              "raw": "USDA-Agricultural Research Service, Ithaca, New York, USA",
              "ror": "02d2m2044"
            }
          ],
          "corresponding": false,
          "name": "Stacy L. DeBlasio",
          "openalex": "A5009086308",
          "orcid": "0000-0003-3208-618X",
          "staff": null
        },
        {
          "affiliations": [
            {
              "country": "US",
              "name": "University of Washington",
              "raw": "Department of Genome Sciences, University of Washington, Seattle, Washington, USA",
              "ror": "00cvxb145"
            }
          ],
          "corresponding": false,
          "name": "Juan D. Chavez",
          "openalex": "A5016223830",
          "orcid": "0000-0001-8849-0304",
          "staff": null
        },
        {
          "affiliations": [
            {
              "country": "US",
              "name": "Boyce Thompson Institute",
              "raw": "Boyce Thompson Institute for Plant Research, Ithaca, New York, USA",
              "ror": "016tr2327"
            },
            {
              "country": "US",
              "name": "Cornell University",
              "raw": "Department of Plant Pathology and Plant-Microbe Biology, Cornell University, Ithaca, New York, USA",
              "ror": "05bnh6r87"
            }
          ],
          "corresponding": false,
          "name": "M. Alexander",
          "openalex": "A5071918131",
          "orcid": "0000-0002-5902-6905",
          "staff": null
        },
        {
          "affiliations": [
            {
              "country": "US",
              "name": "Boyce Thompson Institute",
              "raw": "Boyce Thompson Institute for Plant Research, Ithaca, New York, USA",
              "ror": "016tr2327"
            }
          ],
          "corresponding": false,
          "name": "John Sawyer Ramsey",
          "openalex": "A5032120483",
          "orcid": "0000-0003-1439-500X",
          "staff": null
        },
        {
          "affiliations": [
            {
              "country": "US",
              "name": "University of Washington",
              "raw": "University of Washington Proteomics Resources, Seattle, Washington, USA",
              "ror": "00cvxb145"
            }
          ],
          "corresponding": false,
          "name": "Jimmy K. Eng",
          "openalex": "A5011565192",
          "orcid": "0000-0001-6352-6737",
          "staff": "eng"
        },
        {
          "affiliations": [
            {
              "country": "US",
              "name": "Boyce Thompson Institute",
              "raw": "Boyce Thompson Institute for Plant Research, Ithaca, New York, USA",
              "ror": "016tr2327"
            }
          ],
          "corresponding": false,
          "name": "Jaclyn E. Mahoney",
          "openalex": "A5054518201",
          "orcid": null,
          "staff": null
        },
        {
          "affiliations": [
            {
              "country": "US",
              "name": "Cornell University",
              "raw": "Department of Plant Pathology and Plant-Microbe Biology, Cornell University, Ithaca, New York, USA",
              "ror": "05bnh6r87"
            },
            {
              "country": "US",
              "name": "Agricultural Research Service",
              "raw": "USDA-Agricultural Research Service, Ithaca, New York, USA",
              "ror": "02d2m2044"
            }
          ],
          "corresponding": false,
          "name": "Stewart M. Gray",
          "openalex": "A5091733369",
          "orcid": "0000-0002-8402-1962",
          "staff": null
        },
        {
          "affiliations": [
            {
              "country": "US",
              "name": "University of Washington",
              "raw": "Department of Genome Sciences, University of Washington, Seattle, Washington, USA",
              "ror": "00cvxb145"
            }
          ],
          "corresponding": false,
          "name": "James E. Bruce",
          "openalex": "A5024181058",
          "orcid": "0000-0001-6441-6089",
          "staff": null
        },
        {
          "affiliations": [
            {
              "country": "US",
              "name": "Boyce Thompson Institute",
              "raw": "Boyce Thompson Institute for Plant Research, Ithaca, New York, USA",
              "ror": "016tr2327"
            },
            {
              "country": "US",
              "name": "Cornell University",
              "raw": "Department of Plant Pathology and Plant-Microbe Biology, Cornell University, Ithaca, New York, USA",
              "ror": "05bnh6r87"
            },
            {
              "country": "US",
              "name": "Agricultural Research Service",
              "raw": "USDA-Agricultural Research Service, Ithaca, New York, USA",
              "ror": "02d2m2044"
            }
          ],
          "corresponding": false,
          "name": "Michelle Cilia",
          "openalex": "A5108391104",
          "orcid": null,
          "staff": null
        }
      ],
      "fulltext": {
        "cache": null,
        "checked": "2026-09-27",
        "recheck_after": "2026-12-26",
        "status": "unavailable"
      },
      "id": "R-000145",
      "ids": {
        "doi": "10.1128/jvi.01706-15",
        "openalex": "W2189767351",
        "pmcid": "PMC4733995",
        "pmid": "26656710"
      },
      "kind": "article",
      "oa": {
        "license": null,
        "status": "green",
        "url": "https://www.ncbi.nlm.nih.gov/pmc/articles/4733995"
      },
      "published": "2015-12-11",
      "retracted": false,
      "sources": {
        "openalex": "2026-09-26"
      },
      "title": "Visualization of Host-Polerovirus Interaction Topologies Using Protein Interaction Reporter Technology",
      "topics": [
        {
          "domain": "Life Sciences",
          "field": "Agricultural and Biological Sciences",
          "score": 0.9990000128746033,
          "subfield": "Plant Science",
          "topic": "Plant Virus Research Studies"
        },
        {
          "domain": "Physical Sciences",
          "field": "Chemistry",
          "score": 0.0003000000142492354,
          "subfield": "Spectroscopy",
          "topic": "Advanced Proteomics Techniques and Applications"
        },
        {
          "domain": "Life Sciences",
          "field": "Agricultural and Biological Sciences",
          "score": 0.00019999999494757503,
          "subfield": "Plant Science",
          "topic": "Phytoplasmas and Hemiptera pathogens"
        }
      ],
      "venue": {
        "issn_l": "0022-538X",
        "name": "Journal of Virology",
        "publisher": "American Society for Microbiology"
      },
      "version_link": null,
      "year": 2015
    }
  ],
  "rule_version": "2026-09-26.1",
  "schema": 1,
  "status": {
    "basis": "rules",
    "included": true,
    "since": "2026-09-20"
  },
  "updated": "2026-10-10"
}
