{
  "aliases": [],
  "canonical": "R-000012",
  "created": "2026-09-19",
  "discovery": [
    {
      "channel": "F",
      "first_seen": "2026-09-19",
      "last_seen": "2026-09-19",
      "record": "R-000012"
    },
    {
      "channel": "G",
      "first_seen": "2026-09-19",
      "last_seen": "2026-09-19",
      "record": "R-000012"
    }
  ],
  "evidence": [
    {
      "criterion": 3,
      "detail": {},
      "excerpt": "University of Washington Proteomics Resource, 850 Republican Street, Seattle, WA 98109, USA",
      "first_seen": "2026-09-19",
      "label": "An author's affiliation is the UW Proteomics Resource",
      "last_seen": "2026-09-19",
      "record": "R-000012",
      "rule": "R5",
      "rule_version": "2026-09-19.2",
      "section": "affiliation",
      "source": {
        "cache": "sha256:33d25b3fb913b3f452702ee2c23c868b2d91a37d5af941fc92891c39fd8b8c71",
        "name": "PMC",
        "retrieved": "2026-09-19",
        "url": "https://pmc.ncbi.nlm.nih.gov/articles/PMC13484654/"
      }
    }
  ],
  "id": "W-000011",
  "records": [
    {
      "abstract": {
        "cache": "sha256:423e0984c06d9c8ab22e4ee7635f2834dfa1196fc5835574012d229a424a1af3"
      },
      "authors": [
        {
          "affiliations": [
            {
              "country": "US",
              "name": "University of Iowa",
              "raw": "Proteomics Facility, Carver College of Medicine, University of Iowa, 431 Newton Road, Iowa City, IA 52242, USA",
              "ror": "036jqmy94"
            }
          ],
          "corresponding": false,
          "name": "Celeste Ptak",
          "openalex": "A5125665745",
          "orcid": null,
          "staff": null
        },
        {
          "affiliations": [
            {
              "country": null,
              "name": null,
              "raw": "KEYENCE Corporation of America, Life Science Division, 601 Carlson Parkway, Suite 800, Minnetonka, MN 55305, USA",
              "ror": null
            }
          ],
          "corresponding": false,
          "name": "Conor O'Rourke",
          "openalex": "A5040803272",
          "orcid": null,
          "staff": null
        },
        {
          "affiliations": [
            {
              "country": "US",
              "name": "University of Washington",
              "raw": "University of Washington Proteomics Resource, 850 Republican Street, Seattle, WA 98109, USA",
              "ror": "00cvxb145"
            }
          ],
          "corresponding": false,
          "name": "Jimmy K. Eng",
          "openalex": "A5011565192",
          "orcid": "0000-0001-6352-6737",
          "staff": "eng"
        },
        {
          "affiliations": [
            {
              "country": "US",
              "name": "National Jewish Health",
              "raw": "Department of Immunology and Genomic Medicine, National Jewish Health, 1400 Jackson Street, Denver, CO 80206, USA",
              "ror": "016z2bp30"
            }
          ],
          "corresponding": false,
          "name": "Lilliana Radoshevich",
          "openalex": "A5145656791",
          "orcid": null,
          "staff": null
        },
        {
          "affiliations": [
            {
              "country": "US",
              "name": "University of Iowa",
              "raw": "Department of Molecular Physiology and Biophysics, Carver College of Medicine, University of Iowa, 51 Newton Road, Iowa City, IA 52242, USA",
              "ror": "036jqmy94"
            }
          ],
          "corresponding": true,
          "name": "Michael E. Wright",
          "openalex": "A5058458319",
          "orcid": "0000-0002-4243-2931",
          "staff": null
        }
      ],
      "fulltext": {
        "cache": "sha256:33d25b3fb913b3f452702ee2c23c868b2d91a37d5af941fc92891c39fd8b8c71",
        "checked": "2026-09-19",
        "recheck_after": null,
        "status": "pmc_xml"
      },
      "id": "R-000012",
      "ids": {
        "doi": "10.64898/2026.08.03.742469",
        "openalex": "W7196960225",
        "pmcid": "PMC13484654",
        "pmid": "42620099"
      },
      "kind": "preprint",
      "oa": {
        "license": "cc-by-nc-nd",
        "status": "green",
        "url": "https://doi.org/10.64898/2026.08.03.742469"
      },
      "published": "2026-08-06",
      "retracted": false,
      "sources": {
        "openalex": "2026-09-19",
        "pmc": "2026-09-19"
      },
      "title": "A Spatiotemporal Atlas of the Androgen Receptor Proximal Interactome",
      "topics": [
        {
          "domain": "Life Sciences",
          "field": "Biochemistry, Genetics and Molecular Biology",
          "score": 0.8099,
          "subfield": "Cell Biology",
          "topic": "Biotin and Related Studies"
        },
        {
          "domain": "Physical Sciences",
          "field": "Chemistry",
          "score": 0.0371,
          "subfield": "Spectroscopy",
          "topic": "Advanced Proteomics Techniques and Applications"
        },
        {
          "domain": "Life Sciences",
          "field": "Biochemistry, Genetics and Molecular Biology",
          "score": 0.0244,
          "subfield": "Molecular Biology",
          "topic": "Ubiquitin and proteasome pathways"
        }
      ],
      "venue": {
        "issn_l": null,
        "name": "bioRxiv (Cold Spring Harbor Laboratory)",
        "publisher": "Cold Spring Harbor Laboratory"
      },
      "version_link": null,
      "year": 2026
    }
  ],
  "rule_version": "2026-09-19.2",
  "schema": 1,
  "status": {
    "basis": "rules",
    "included": true,
    "since": "2026-09-19"
  },
  "updated": "2026-09-19"
}
