{
  "aliases": [],
  "canonical": "R-000180",
  "created": "2026-09-20",
  "discovery": [
    {
      "channel": "A",
      "first_seen": "2026-09-20",
      "last_seen": "2026-09-26",
      "record": "R-000180"
    },
    {
      "channel": "C1",
      "first_seen": "2026-09-20",
      "last_seen": "2026-09-26",
      "record": "R-000180"
    },
    {
      "channel": "C2",
      "first_seen": "2026-10-10",
      "last_seen": "2026-10-10",
      "record": "R-000180"
    },
    {
      "channel": "D1",
      "first_seen": "2026-09-20",
      "last_seen": "2026-09-26",
      "record": "R-000180"
    },
    {
      "channel": "D2",
      "first_seen": "2026-10-10",
      "last_seen": "2026-10-10",
      "record": "R-000180"
    }
  ],
  "evidence": [
    {
      "criterion": 1,
      "detail": {
        "first_seen": "2026-09-20",
        "last_seen": "2026-09-26",
        "list_key": "list:older:dce261b575fe",
        "page": "older"
      },
      "excerpt": null,
      "first_seen": "2026-09-20",
      "label": "Listed on UWPR's publications page",
      "last_seen": "2026-09-26",
      "record": "R-000180",
      "rule": "R1",
      "rule_version": "2026-09-26.1",
      "section": "official list",
      "source": {
        "cache": null,
        "name": "UWPR website",
        "retrieved": "2026-09-26",
        "url": "https://proteomicsresource.washington.edu/publications/older/"
      }
    },
    {
      "criterion": 2,
      "detail": {
        "phrase": "UWPR95794",
        "query_date": "2026-10-10"
      },
      "excerpt": null,
      "first_seen": "2026-10-10",
      "label": "Phrase found in OpenAlex's full-text index of the paper",
      "last_seen": "2026-10-10",
      "record": "R-000180",
      "rule": "R6",
      "rule_version": "2026-09-26.1",
      "section": "full-text index",
      "source": {
        "cache": null,
        "name": "OpenAlex",
        "retrieved": "2026-10-10",
        "url": "https://api.openalex.org/works?filter=fulltext.search:UWPR95794,doi:10.1073%2Fpnas.1708727114"
      }
    },
    {
      "criterion": 4,
      "detail": {
        "phrase": "Washington's Proteomics Resource",
        "query_date": "2026-10-10"
      },
      "excerpt": null,
      "first_seen": "2026-10-10",
      "label": "Phrase found in OpenAlex's full-text index of the paper",
      "last_seen": "2026-10-10",
      "record": "R-000180",
      "rule": "R6",
      "rule_version": "2026-09-26.1",
      "section": "full-text index",
      "source": {
        "cache": null,
        "name": "OpenAlex",
        "retrieved": "2026-10-10",
        "url": "https://api.openalex.org/works?filter=fulltext.search:%22Washington%27s%20Proteomics%20Resource%22,doi:10.1073%2Fpnas.1708727114"
      }
    }
  ],
  "id": "W-000180",
  "records": [
    {
      "abstract": null,
      "authors": [
        {
          "affiliations": [
            {
              "country": "US",
              "name": "University of Washington",
              "raw": "Department of Biochemistry, University of Washington, Seattle, WA 98195;",
              "ror": "00cvxb145"
            }
          ],
          "corresponding": false,
          "name": "Alexandra C. Walls",
          "openalex": "A5021781776",
          "orcid": "0000-0002-9636-8330",
          "staff": null
        },
        {
          "affiliations": [
            {
              "country": null,
              "name": null,
              "raw": "CNRS UMR 3569 Virologie, 75015 Paris, France;",
              "ror": null
            },
            {
              "country": "FR",
              "name": "Institut Pasteur",
              "raw": "Département de Virologie, Unité de Virologie Structurale, Institut Pasteur, Paris, France;",
              "ror": "0495fxg12"
            }
          ],
          "corresponding": false,
          "name": "M. Alejandra Tortorici",
          "openalex": "A5006936042",
          "orcid": "0000-0002-2260-2577",
          "staff": null
        },
        {
          "affiliations": [
            {
              "country": "US",
              "name": "University of Washington",
              "raw": "Department of Biochemistry, University of Washington, Seattle, WA 98195;",
              "ror": "00cvxb145"
            }
          ],
          "corresponding": false,
          "name": "Joost Snijder",
          "openalex": "A5050510032",
          "orcid": "0000-0002-9310-8226",
          "staff": null
        },
        {
          "affiliations": [
            {
              "country": "US",
              "name": "University of Washington",
              "raw": "Department of Biochemistry, University of Washington, Seattle, WA 98195;",
              "ror": "00cvxb145"
            }
          ],
          "corresponding": false,
          "name": "Xiaoli Xiong",
          "openalex": "A5006351471",
          "orcid": "0000-0002-4632-9122",
          "staff": null
        },
        {
          "affiliations": [
            {
              "country": "NL",
              "name": "Utrecht University",
              "raw": "Virology Division, Department of Infectious Diseases and Immunology, Faculty of Veterinary Medicine, Utrecht University, 3584 CL Utrecht, The Netherlands",
              "ror": "04pp8hn57"
            }
          ],
          "corresponding": false,
          "name": "Berend‐Jan Bosch",
          "openalex": "A5080132990",
          "orcid": "0000-0002-3864-232X",
          "staff": null
        },
        {
          "affiliations": [
            {
              "country": null,
              "name": null,
              "raw": "CNRS UMR 3569 Virologie, 75015 Paris, France;",
              "ror": null
            },
            {
              "country": "FR",
              "name": "Institut Pasteur",
              "raw": "Département de Virologie, Unité de Virologie Structurale, Institut Pasteur, Paris, France;",
              "ror": "0495fxg12"
            }
          ],
          "corresponding": false,
          "name": "Felix Augusto Rey",
          "openalex": "A5028725593",
          "orcid": "0000-0002-9953-7988",
          "staff": null
        },
        {
          "affiliations": [
            {
              "country": "US",
              "name": "University of Washington",
              "raw": "Department of Biochemistry, University of Washington, Seattle, WA 98195;",
              "ror": "00cvxb145"
            }
          ],
          "corresponding": true,
          "name": "David Veesler",
          "openalex": "A5085406779",
          "orcid": "0000-0002-6019-8675",
          "staff": null
        }
      ],
      "fulltext": {
        "cache": null,
        "checked": "2026-09-27",
        "recheck_after": "2026-12-26",
        "status": "unavailable"
      },
      "id": "R-000180",
      "ids": {
        "doi": "10.1073/pnas.1708727114",
        "openalex": "W2762161295",
        "pmcid": "PMC5651768",
        "pmid": "29073020"
      },
      "kind": "article",
      "oa": {
        "license": null,
        "status": "bronze",
        "url": "https://doi.org/10.1073/pnas.1708727114"
      },
      "published": "2017-10-03",
      "retracted": false,
      "sources": {
        "openalex": "2026-09-26"
      },
      "title": "Tectonic conformational changes of a coronavirus spike glycoprotein promote membrane fusion",
      "topics": [
        {
          "domain": "Health Sciences",
          "field": "Medicine",
          "score": 0.9922000169754028,
          "subfield": "Infectious Diseases",
          "topic": "SARS-CoV-2 and COVID-19 Research"
        },
        {
          "domain": "Life Sciences",
          "field": "Biochemistry, Genetics and Molecular Biology",
          "score": 0.0010000000474974513,
          "subfield": "Molecular Biology",
          "topic": "Protein Structure and Dynamics"
        },
        {
          "domain": "Health Sciences",
          "field": "Medicine",
          "score": 0.0007999999797903001,
          "subfield": "Epidemiology",
          "topic": "Virology and Viral Diseases"
        }
      ],
      "venue": {
        "issn_l": "0027-8424",
        "name": "Proceedings of the National Academy of Sciences",
        "publisher": "National Academy of Sciences"
      },
      "version_link": null,
      "year": 2017
    }
  ],
  "rule_version": "2026-09-26.1",
  "schema": 1,
  "status": {
    "basis": "rules",
    "included": true,
    "since": "2026-09-20"
  },
  "updated": "2026-10-10"
}
