{
  "aliases": [],
  "canonical": "R-000272",
  "created": "2026-09-20",
  "discovery": [
    {
      "channel": "A",
      "first_seen": "2026-09-20",
      "last_seen": "2026-09-26",
      "record": "R-000272"
    },
    {
      "channel": "B1",
      "first_seen": "2026-09-20",
      "last_seen": "2026-09-26",
      "record": "R-000272"
    },
    {
      "channel": "C1",
      "first_seen": "2026-09-20",
      "last_seen": "2026-09-26",
      "record": "R-000272"
    },
    {
      "channel": "C2",
      "first_seen": "2026-09-20",
      "last_seen": "2026-09-26",
      "record": "R-000272"
    },
    {
      "channel": "D1",
      "first_seen": "2026-09-20",
      "last_seen": "2026-09-26",
      "record": "R-000272"
    },
    {
      "channel": "D2",
      "first_seen": "2026-09-20",
      "last_seen": "2026-09-26",
      "record": "R-000272"
    },
    {
      "channel": "E",
      "first_seen": "2026-09-20",
      "last_seen": "2026-09-26",
      "record": "R-000272"
    }
  ],
  "evidence": [
    {
      "criterion": 1,
      "detail": {
        "first_seen": "2026-09-20",
        "last_seen": "2026-09-26",
        "list_key": "list:2022:25d42efa4cae",
        "page": "2022"
      },
      "excerpt": null,
      "first_seen": "2026-09-20",
      "label": "Listed on UWPR's publications page",
      "last_seen": "2026-09-26",
      "record": "R-000272",
      "rule": "R1",
      "rule_version": "2026-09-26.1",
      "section": "official list",
      "source": {
        "cache": null,
        "name": "UWPR website",
        "retrieved": "2026-09-26",
        "url": "https://proteomicsresource.washington.edu/publications/2022/"
      }
    },
    {
      "criterion": 2,
      "detail": {
        "match": "text"
      },
      "excerpt": "We are grateful to P. von Haller at the University of Washington’s Proteomics Resource (UWPR95794) for the assistance with mass spectrometry analysis.",
      "first_seen": "2026-09-20",
      "label": "UWPR award code (UWPR95794) stated in the paper",
      "last_seen": "2026-09-20",
      "record": "R-000272",
      "rule": "R2",
      "rule_version": "2026-09-26.1",
      "section": "acknowledgements",
      "source": {
        "cache": "sha256:173776acdcbdb4e428450954f448d6236e016f8ac790d7f384bc11b9ecaca321",
        "name": "PMC",
        "retrieved": "2026-09-20",
        "url": "https://pmc.ncbi.nlm.nih.gov/articles/PMC9199386/"
      }
    },
    {
      "criterion": 2,
      "detail": {
        "field": "awards[].funder_award_id"
      },
      "excerpt": "UWPR95794",
      "first_seen": "2026-09-20",
      "label": "UWPR award code (UWPR95794) in the publication's funding metadata",
      "last_seen": "2026-09-20",
      "record": "R-000272",
      "rule": "R2",
      "rule_version": "2026-09-26.1",
      "section": "metadata",
      "source": {
        "cache": null,
        "name": "OpenAlex",
        "retrieved": "2026-09-20",
        "url": "https://api.openalex.org/works/W4281967292"
      }
    },
    {
      "criterion": 3,
      "detail": {
        "staff": "vonhaller"
      },
      "excerpt": "We are grateful to P. von Haller at the University of Washington’s Proteomics Resource (UWPR95794) for the assistance with mass spectrometry analysis.",
      "first_seen": "2026-09-20",
      "label": "The paper names the UW Proteomics Resource",
      "last_seen": "2026-09-20",
      "record": "R-000272",
      "rule": "R3",
      "rule_version": "2026-09-26.1",
      "section": "acknowledgements",
      "source": {
        "cache": "sha256:173776acdcbdb4e428450954f448d6236e016f8ac790d7f384bc11b9ecaca321",
        "name": "PMC",
        "retrieved": "2026-09-20",
        "url": "https://pmc.ncbi.nlm.nih.gov/articles/PMC9199386/"
      }
    },
    {
      "criterion": 3,
      "detail": {
        "staff": "vonhaller"
      },
      "excerpt": "We are grateful to P. von Haller at the University of Washington’s Proteomics Resource (UWPR95794) for the assistance with mass spectrometry analysis.",
      "first_seen": "2026-09-20",
      "label": "A UWPR staff member is thanked for data-analysis or technical help",
      "last_seen": "2026-09-20",
      "record": "R-000272",
      "rule": "R7",
      "rule_version": "2026-09-26.1",
      "section": "acknowledgements",
      "source": {
        "cache": "sha256:173776acdcbdb4e428450954f448d6236e016f8ac790d7f384bc11b9ecaca321",
        "name": "PMC",
        "retrieved": "2026-09-20",
        "url": "https://pmc.ncbi.nlm.nih.gov/articles/PMC9199386/"
      }
    }
  ],
  "id": "W-000272",
  "records": [
    {
      "abstract": null,
      "authors": [
        {
          "affiliations": [
            {
              "country": "US",
              "name": "University of Washington",
              "raw": "Department of Mechanical Engineering, University of Washington, Seattle, WA, United States",
              "ror": "00cvxb145"
            }
          ],
          "corresponding": false,
          "name": "Sheng‐You Chen",
          "openalex": "A5061791031",
          "orcid": null,
          "staff": null
        },
        {
          "affiliations": [
            {
              "country": "US",
              "name": "University of Washington",
              "raw": "Department of Bioengineering, University of Washington, Seattle, WA, United States",
              "ror": "00cvxb145"
            }
          ],
          "corresponding": false,
          "name": "Abe Y. Wu",
          "openalex": "A5051968483",
          "orcid": "0009-0007-8815-6091",
          "staff": null
        },
        {
          "affiliations": [
            {
              "country": "US",
              "name": "University of Washington",
              "raw": "Department of Bioengineering, University of Washington, Seattle, WA, United States",
              "ror": "00cvxb145"
            }
          ],
          "corresponding": false,
          "name": "Ruby Lunde",
          "openalex": "A5037782960",
          "orcid": null,
          "staff": null
        },
        {
          "affiliations": [
            {
              "country": "US",
              "name": "University of Washington",
              "raw": "Department of Bioengineering, University of Washington, Seattle, WA, United States",
              "ror": "00cvxb145"
            }
          ],
          "corresponding": true,
          "name": "James J. Lai",
          "openalex": "A5008596372",
          "orcid": "0000-0003-3437-7810",
          "staff": null
        }
      ],
      "fulltext": {
        "cache": "sha256:173776acdcbdb4e428450954f448d6236e016f8ac790d7f384bc11b9ecaca321",
        "checked": "2026-09-27",
        "recheck_after": null,
        "status": "pmc_xml"
      },
      "id": "R-000272",
      "ids": {
        "doi": "10.3389/fbioe.2022.884271",
        "openalex": "W4281967292",
        "pmcid": "PMC9199386",
        "pmid": "35721843"
      },
      "kind": "article",
      "oa": {
        "license": "cc-by",
        "status": "gold",
        "url": "https://doi.org/10.3389/fbioe.2022.884271"
      },
      "published": "2022-06-01",
      "retracted": false,
      "sources": {
        "openalex": "2026-09-26"
      },
      "title": "Osmotic Processor for Enabling Sensitive and Rapid Biomarker Detection via Lateral Flow Assays",
      "topics": [
        {
          "domain": "Physical Sciences",
          "field": "Engineering",
          "score": 0.9984999895095825,
          "subfield": "Biomedical Engineering",
          "topic": "Biosensors and Analytical Detection"
        },
        {
          "domain": "Health Sciences",
          "field": "Medicine",
          "score": 0.0007999999797903001,
          "subfield": "Infectious Diseases",
          "topic": "SARS-CoV-2 detection and testing"
        },
        {
          "domain": "Physical Sciences",
          "field": "Engineering",
          "score": 0.0005000000237487257,
          "subfield": "Biomedical Engineering",
          "topic": "Microfluidic and Capillary Electrophoresis Applications"
        }
      ],
      "venue": {
        "issn_l": "2296-4185",
        "name": "Frontiers in Bioengineering and Biotechnology",
        "publisher": "Frontiers Media"
      },
      "version_link": null,
      "year": 2022
    }
  ],
  "rule_version": "2026-09-26.1",
  "schema": 1,
  "status": {
    "basis": "rules",
    "included": true,
    "since": "2026-09-20"
  },
  "updated": "2026-10-10"
}
