{
  "aliases": [],
  "canonical": "R-000190",
  "created": "2026-09-20",
  "discovery": [
    {
      "channel": "A",
      "first_seen": "2026-09-20",
      "last_seen": "2026-09-26",
      "record": "R-000190"
    },
    {
      "channel": "C1",
      "first_seen": "2026-09-20",
      "last_seen": "2026-09-26",
      "record": "R-000190"
    },
    {
      "channel": "G",
      "first_seen": "2026-09-20",
      "last_seen": "2026-09-26",
      "record": "R-000190"
    }
  ],
  "evidence": [
    {
      "criterion": 1,
      "detail": {
        "first_seen": "2026-09-20",
        "last_seen": "2026-09-26",
        "list_key": "list:older:de49d3b533f1",
        "page": "older"
      },
      "excerpt": null,
      "first_seen": "2026-09-20",
      "label": "Listed on UWPR's publications page",
      "last_seen": "2026-09-26",
      "record": "R-000190",
      "rule": "R1",
      "rule_version": "2026-09-26.1",
      "section": "official list",
      "source": {
        "cache": null,
        "name": "UWPR website",
        "retrieved": "2026-09-26",
        "url": "https://proteomicsresource.washington.edu/publications/older/"
      }
    },
    {
      "criterion": 4,
      "detail": {},
      "excerpt": "We acknowledge all members of the Bruce lab and UWPR for productive discussions during development.",
      "first_seen": "2026-09-20",
      "label": "The paper names the UW Proteomics Resource",
      "last_seen": "2026-09-20",
      "record": "R-000190",
      "rule": "R3",
      "rule_version": "2026-09-26.1",
      "section": "acknowledgements",
      "source": {
        "cache": "sha256:8f0fa30786b871066b66eaac086bcfdea1e6a3af03427bbe3d9c7f11f7ab0a79",
        "name": "PMC",
        "retrieved": "2026-09-20",
        "url": "https://pmc.ncbi.nlm.nih.gov/articles/PMC5959040/"
      }
    }
  ],
  "id": "W-000190",
  "records": [
    {
      "abstract": null,
      "authors": [
        {
          "affiliations": [
            {
              "country": "US",
              "name": "University of Washington",
              "raw": "Department of Genome Sciences, University of Washington, Seattle, Washington 98105, United States",
              "ror": "00cvxb145"
            }
          ],
          "corresponding": false,
          "name": "Jared P. Mohr",
          "openalex": "A5008424956",
          "orcid": null,
          "staff": null
        },
        {
          "affiliations": [
            {
              "country": "US",
              "name": "University of Washington",
              "raw": "Department of Genome Sciences, University of Washington, Seattle, Washington 98105, United States",
              "ror": "00cvxb145"
            }
          ],
          "corresponding": false,
          "name": "Poorna Perumalla",
          "openalex": "A5073172363",
          "orcid": null,
          "staff": null
        },
        {
          "affiliations": [
            {
              "country": "US",
              "name": "University of Washington",
              "raw": "Department of Genome Sciences, University of Washington, Seattle, Washington 98105, United States",
              "ror": "00cvxb145"
            }
          ],
          "corresponding": false,
          "name": "Juan D. Chavez",
          "openalex": "A5016223830",
          "orcid": "0000-0001-8849-0304",
          "staff": null
        },
        {
          "affiliations": [
            {
              "country": "US",
              "name": "University of Washington",
              "raw": "Department of Genome Sciences, University of Washington, Seattle, Washington 98105, United States",
              "ror": "00cvxb145"
            }
          ],
          "corresponding": false,
          "name": "Jimmy K. Eng",
          "openalex": "A5011565192",
          "orcid": "0000-0001-6352-6737",
          "staff": "eng"
        },
        {
          "affiliations": [
            {
              "country": "US",
              "name": "University of Washington",
              "raw": "Department of Genome Sciences, University of Washington, Seattle, Washington 98105, United States",
              "ror": "00cvxb145"
            }
          ],
          "corresponding": true,
          "name": "James E. Bruce",
          "openalex": "A5024181058",
          "orcid": "0000-0001-6441-6089",
          "staff": null
        }
      ],
      "fulltext": {
        "cache": "sha256:8f0fa30786b871066b66eaac086bcfdea1e6a3af03427bbe3d9c7f11f7ab0a79",
        "checked": "2026-09-27",
        "recheck_after": null,
        "status": "pmc_xml"
      },
      "id": "R-000190",
      "ids": {
        "doi": "10.1021/acs.analchem.7b04991",
        "openalex": "W2801749813",
        "pmcid": "PMC5959040",
        "pmid": "29676898"
      },
      "kind": "article",
      "oa": {
        "license": null,
        "status": "green",
        "url": "https://www.ncbi.nlm.nih.gov/pmc/articles/5959040"
      },
      "published": "2018-04-20",
      "retracted": false,
      "sources": {
        "openalex": "2026-09-26"
      },
      "title": "Mango: A General Tool for Collision Induced Dissociation-Cleavable Cross-Linked Peptide Identification",
      "topics": [
        {
          "domain": "Physical Sciences",
          "field": "Chemistry",
          "score": 0.9282000064849854,
          "subfield": "Spectroscopy",
          "topic": "Advanced Proteomics Techniques and Applications"
        },
        {
          "domain": "Physical Sciences",
          "field": "Chemistry",
          "score": 0.06679999828338623,
          "subfield": "Spectroscopy",
          "topic": "Mass Spectrometry Techniques and Applications"
        },
        {
          "domain": "Physical Sciences",
          "field": "Chemistry",
          "score": 0.0005000000237487257,
          "subfield": "Organic Chemistry",
          "topic": "Click Chemistry and Applications"
        }
      ],
      "venue": {
        "issn_l": "0003-2700",
        "name": "Analytical Chemistry",
        "publisher": "American Chemical Society"
      },
      "version_link": null,
      "year": 2018
    }
  ],
  "rule_version": "2026-09-26.1",
  "schema": 1,
  "status": {
    "basis": "rules",
    "included": true,
    "since": "2026-09-20"
  },
  "updated": "2026-10-10"
}
