{
  "aliases": [],
  "canonical": "R-000116",
  "created": "2026-09-20",
  "discovery": [
    {
      "channel": "A",
      "first_seen": "2026-09-20",
      "last_seen": "2026-09-26",
      "record": "R-000116"
    },
    {
      "channel": "B1",
      "first_seen": "2026-09-20",
      "last_seen": "2026-09-26",
      "record": "R-000116"
    },
    {
      "channel": "C1",
      "first_seen": "2026-09-20",
      "last_seen": "2026-09-26",
      "record": "R-000116"
    },
    {
      "channel": "C2",
      "first_seen": "2026-09-20",
      "last_seen": "2026-09-26",
      "record": "R-000116"
    },
    {
      "channel": "D1",
      "first_seen": "2026-09-20",
      "last_seen": "2026-09-26",
      "record": "R-000116"
    },
    {
      "channel": "D2",
      "first_seen": "2026-09-20",
      "last_seen": "2026-09-26",
      "record": "R-000116"
    },
    {
      "channel": "G",
      "first_seen": "2026-09-20",
      "last_seen": "2026-09-26",
      "record": "R-000116"
    }
  ],
  "evidence": [
    {
      "criterion": 1,
      "detail": {
        "first_seen": "2026-09-20",
        "last_seen": "2026-09-26",
        "list_key": "list:older:b22fb99ef5f9",
        "page": "older"
      },
      "excerpt": null,
      "first_seen": "2026-09-20",
      "label": "Listed on UWPR's publications page",
      "last_seen": "2026-09-26",
      "record": "R-000116",
      "rule": "R1",
      "rule_version": "2026-09-26.1",
      "section": "official list",
      "source": {
        "cache": null,
        "name": "UWPR website",
        "retrieved": "2026-09-26",
        "url": "https://proteomicsresource.washington.edu/publications/older/"
      }
    },
    {
      "criterion": 2,
      "detail": {
        "match": "text"
      },
      "excerpt": "This work is supported by grants P41 GM103533 from the National Institute of General Medical Studies from the National Institutes of Health and the University of Washington Proteomics Resource (UWPR95794).",
      "first_seen": "2026-09-20",
      "label": "UWPR award code (UWPR95794) stated in the paper",
      "last_seen": "2026-09-20",
      "record": "R-000116",
      "rule": "R2",
      "rule_version": "2026-09-26.1",
      "section": "acknowledgements",
      "source": {
        "cache": "sha256:c59aaf9e3a50a23f5df63427a8c39dc7d2dc6d4d47b94e4fcabcccaf3e5c655f",
        "name": "PMC",
        "retrieved": "2026-09-20",
        "url": "https://pmc.ncbi.nlm.nih.gov/articles/PMC4118779/"
      }
    },
    {
      "criterion": 2,
      "detail": {
        "field": "awards[].funder_award_id"
      },
      "excerpt": "UWPR95794",
      "first_seen": "2026-09-20",
      "label": "UWPR award code (UWPR95794) in the publication's funding metadata",
      "last_seen": "2026-09-20",
      "record": "R-000116",
      "rule": "R2",
      "rule_version": "2026-09-26.1",
      "section": "metadata",
      "source": {
        "cache": null,
        "name": "OpenAlex",
        "retrieved": "2026-09-20",
        "url": "https://api.openalex.org/works/W1995987144"
      }
    },
    {
      "criterion": 4,
      "detail": {},
      "excerpt": "This work is supported by grants P41 GM103533 from the National Institute of General Medical Studies from the National Institutes of Health and the University of Washington Proteomics Resource (UWPR95794).",
      "first_seen": "2026-09-20",
      "label": "The paper names the UW Proteomics Resource",
      "last_seen": "2026-09-20",
      "record": "R-000116",
      "rule": "R3",
      "rule_version": "2026-09-26.1",
      "section": "acknowledgements",
      "source": {
        "cache": "sha256:c59aaf9e3a50a23f5df63427a8c39dc7d2dc6d4d47b94e4fcabcccaf3e5c655f",
        "name": "PMC",
        "retrieved": "2026-09-20",
        "url": "https://pmc.ncbi.nlm.nih.gov/articles/PMC4118779/"
      }
    }
  ],
  "id": "W-000116",
  "records": [
    {
      "abstract": null,
      "authors": [
        {
          "affiliations": [
            {
              "country": "US",
              "name": "University of Washington",
              "raw": "Department of Biochemistry, University of Washington, Seattle, UW Box 357350, 1705 NE Pacific St., Seattle, WA, 98195-7350, USA",
              "ror": "00cvxb145"
            }
          ],
          "corresponding": false,
          "name": "Daniel Jaschob",
          "openalex": "A5058134180",
          "orcid": "0000-0002-5383-9702",
          "staff": null
        },
        {
          "affiliations": [
            {
              "country": "US",
              "name": "University of Washington",
              "raw": "Department of Biochemistry, University of Washington, Seattle, UW Box 357350, 1705 NE Pacific St., Seattle, WA, 98195-7350, USA",
              "ror": "00cvxb145"
            }
          ],
          "corresponding": false,
          "name": "Trisha Nell Davis",
          "openalex": "A5022826364",
          "orcid": "0000-0003-4797-3152",
          "staff": null
        },
        {
          "affiliations": [
            {
              "country": "US",
              "name": "University of Washington",
              "raw": "Department of Biochemistry, University of Washington, Seattle, UW Box 357350, 1705 NE Pacific St,, Seattle, WA 98195-7350, USA. mriffle@uw.edu",
              "ror": "00cvxb145"
            },
            {
              "country": "US",
              "name": "University of Washington",
              "raw": "Department of Genome Sciences, University of Washington, Seattle, UW Box 357350, 1705 NE Pacific St., Seattle, WA, 98195-7350, USA",
              "ror": "00cvxb145"
            }
          ],
          "corresponding": true,
          "name": "Michael E. Riffle",
          "openalex": "A5067746093",
          "orcid": "0000-0003-1633-8607",
          "staff": "riffle"
        }
      ],
      "fulltext": {
        "cache": "sha256:c59aaf9e3a50a23f5df63427a8c39dc7d2dc6d4d47b94e4fcabcccaf3e5c655f",
        "checked": "2026-09-27",
        "recheck_after": null,
        "status": "pmc_xml"
      },
      "id": "R-000116",
      "ids": {
        "doi": "10.1186/1756-0500-7-468",
        "openalex": "W1995987144",
        "pmcid": "PMC4118779",
        "pmid": "25056180"
      },
      "kind": "article",
      "oa": {
        "license": "cc-by",
        "status": "gold",
        "url": "https://doi.org/10.1186/1756-0500-7-468"
      },
      "published": "2014-07-23",
      "retracted": false,
      "sources": {
        "openalex": "2026-09-26"
      },
      "title": "SnipViz: a compact and lightweight web site widget for display and dissemination of multiple versions of gene and protein sequences",
      "topics": [
        {
          "domain": "Life Sciences",
          "field": "Biochemistry, Genetics and Molecular Biology",
          "score": 0.9121000170707703,
          "subfield": "Molecular Biology",
          "topic": "Genomics and Phylogenetic Studies"
        },
        {
          "domain": "Life Sciences",
          "field": "Biochemistry, Genetics and Molecular Biology",
          "score": 0.026499999687075615,
          "subfield": "Molecular Biology",
          "topic": "Genetics, Bioinformatics, and Biomedical Research"
        },
        {
          "domain": "Social Sciences",
          "field": "Decision Sciences",
          "score": 0.01860000006854534,
          "subfield": "Information Systems and Management",
          "topic": "Scientific Computing and Data Management"
        }
      ],
      "venue": {
        "issn_l": "1756-0500",
        "name": "BMC Research Notes",
        "publisher": "BioMed Central"
      },
      "version_link": null,
      "year": 2014
    }
  ],
  "rule_version": "2026-09-26.1",
  "schema": 1,
  "status": {
    "basis": "rules",
    "included": true,
    "since": "2026-09-20"
  },
  "updated": "2026-10-10"
}
