{
  "aliases": [],
  "canonical": "R-000214",
  "created": "2026-09-20",
  "discovery": [
    {
      "channel": "A",
      "first_seen": "2026-09-20",
      "last_seen": "2026-09-26",
      "record": "R-000214"
    },
    {
      "channel": "C1",
      "first_seen": "2026-09-20",
      "last_seen": "2026-09-26",
      "record": "R-000214"
    },
    {
      "channel": "D1",
      "first_seen": "2026-09-20",
      "last_seen": "2026-09-26",
      "record": "R-000214"
    },
    {
      "channel": "E",
      "first_seen": "2026-09-20",
      "last_seen": "2026-09-26",
      "record": "R-000214"
    }
  ],
  "evidence": [
    {
      "criterion": 1,
      "detail": {
        "first_seen": "2026-09-20",
        "last_seen": "2026-09-26",
        "list_key": "list:older:a0f3f2599513",
        "page": "older"
      },
      "excerpt": null,
      "first_seen": "2026-09-20",
      "label": "Listed on UWPR's publications page",
      "last_seen": "2026-09-26",
      "record": "R-000214",
      "rule": "R1",
      "rule_version": "2026-09-26.1",
      "section": "official list",
      "source": {
        "cache": null,
        "name": "UWPR website",
        "retrieved": "2026-09-26",
        "url": "https://proteomicsresource.washington.edu/publications/older/"
      }
    },
    {
      "criterion": 3,
      "detail": {
        "staff": "vonhaller"
      },
      "excerpt": "We thank Priska D. von Haller at University of Washington Proteomics Resource (UWPR) and Martin Sadilek for mass spectrometry assistance.",
      "first_seen": "2026-09-20",
      "label": "The paper names the UW Proteomics Resource",
      "last_seen": "2026-09-20",
      "record": "R-000214",
      "rule": "R3",
      "rule_version": "2026-09-26.1",
      "section": "acknowledgements",
      "source": {
        "cache": "sha256:7fa0fbc2d3fe7b1ec585f5dc7af6830baa14a56826430d38921eebf758f3a9b7",
        "name": "PMC",
        "retrieved": "2026-09-20",
        "url": "https://pmc.ncbi.nlm.nih.gov/articles/PMC6688853/"
      }
    },
    {
      "criterion": 3,
      "detail": {
        "staff": "vonhaller"
      },
      "excerpt": "We thank Priska D. von Haller at University of Washington Proteomics Resource (UWPR) and Martin Sadilek for mass spectrometry assistance.",
      "first_seen": "2026-09-20",
      "label": "A UWPR staff member is thanked for data-analysis or technical help",
      "last_seen": "2026-09-20",
      "record": "R-000214",
      "rule": "R7",
      "rule_version": "2026-09-26.1",
      "section": "acknowledgements",
      "source": {
        "cache": "sha256:7fa0fbc2d3fe7b1ec585f5dc7af6830baa14a56826430d38921eebf758f3a9b7",
        "name": "PMC",
        "retrieved": "2026-09-20",
        "url": "https://pmc.ncbi.nlm.nih.gov/articles/PMC6688853/"
      }
    }
  ],
  "id": "W-000214",
  "records": [
    {
      "abstract": null,
      "authors": [
        {
          "affiliations": [
            {
              "country": "US",
              "name": "University of Washington",
              "raw": "Department of Chemistry, University of Washington, Seattle, Washington 98195, United States",
              "ror": "00cvxb145"
            }
          ],
          "corresponding": false,
          "name": "Linglan Fang",
          "openalex": "A5003432548",
          "orcid": "0000-0003-2637-090X",
          "staff": null
        },
        {
          "affiliations": [
            {
              "country": "US",
              "name": "University of Washington",
              "raw": "Department of Chemistry, University of Washington, Seattle, Washington 98195, United States",
              "ror": "00cvxb145"
            }
          ],
          "corresponding": false,
          "name": "Sujata Chakraborty",
          "openalex": "A5032347056",
          "orcid": "0000-0003-0080-3180",
          "staff": null
        },
        {
          "affiliations": [
            {
              "country": "US",
              "name": "University of Washington",
              "raw": "Department of Chemistry, University of Washington, Seattle, Washington 98195, United States",
              "ror": "00cvxb145"
            }
          ],
          "corresponding": false,
          "name": "Emily M. Dieter",
          "openalex": "A5068023412",
          "orcid": "0009-0004-2294-9775",
          "staff": null
        },
        {
          "affiliations": [
            {
              "country": "US",
              "name": "University of Washington",
              "raw": "Department of Chemistry, University of Washington, Seattle, Washington 98195, United States",
              "ror": "00cvxb145"
            }
          ],
          "corresponding": false,
          "name": "Zachary E. Potter",
          "openalex": "A5067945060",
          "orcid": "0000-0002-9063-7923",
          "staff": null
        },
        {
          "affiliations": [
            {
              "country": "US",
              "name": "University of Washington",
              "raw": "Department of Chemistry, University of Washington, Seattle, Washington 98195, United States",
              "ror": "00cvxb145"
            }
          ],
          "corresponding": false,
          "name": "Chloe K. Lombard",
          "openalex": "A5016646503",
          "orcid": null,
          "staff": null
        },
        {
          "affiliations": [
            {
              "country": "US",
              "name": "University of Washington",
              "raw": "Department of Chemistry  and  Biochemistry, University of Washington, Seattle, Washington 98195, United States",
              "ror": "00cvxb145"
            }
          ],
          "corresponding": true,
          "name": "Dustin J. Maly",
          "openalex": "A5054397869",
          "orcid": "0000-0003-0094-0177",
          "staff": null
        }
      ],
      "fulltext": {
        "cache": "sha256:7fa0fbc2d3fe7b1ec585f5dc7af6830baa14a56826430d38921eebf758f3a9b7",
        "checked": "2026-09-27",
        "recheck_after": null,
        "status": "pmc_xml"
      },
      "id": "R-000214",
      "ids": {
        "doi": "10.1021/jacs.9b02963",
        "openalex": "W2954246512",
        "pmcid": "PMC6688853",
        "pmid": "31274292"
      },
      "kind": "article",
      "oa": {
        "license": null,
        "status": "green",
        "url": "https://www.ncbi.nlm.nih.gov/pmc/articles/6688853"
      },
      "published": "2019-06-24",
      "retracted": false,
      "sources": {
        "openalex": "2026-09-26"
      },
      "title": "Chemoproteomic Method for Profiling Inhibitor-Bound Kinase Complexes",
      "topics": [
        {
          "domain": "Physical Sciences",
          "field": "Chemistry",
          "score": 0.7314000129699707,
          "subfield": "Organic Chemistry",
          "topic": "Click Chemistry and Applications"
        },
        {
          "domain": "Physical Sciences",
          "field": "Chemistry",
          "score": 0.09629999846220016,
          "subfield": "Spectroscopy",
          "topic": "Advanced Proteomics Techniques and Applications"
        },
        {
          "domain": "Life Sciences",
          "field": "Biochemistry, Genetics and Molecular Biology",
          "score": 0.07859999686479568,
          "subfield": "Cell Biology",
          "topic": "Biotin and Related Studies"
        }
      ],
      "venue": {
        "issn_l": "0002-7863",
        "name": "Journal of the American Chemical Society",
        "publisher": "American Chemical Society"
      },
      "version_link": null,
      "year": 2019
    }
  ],
  "rule_version": "2026-09-26.1",
  "schema": 1,
  "status": {
    "basis": "rules",
    "included": true,
    "since": "2026-09-20"
  },
  "updated": "2026-10-10"
}
